{
  "checks": {
    "full_capture_exact_byte_passthrough": "PASS",
    "observer_authorization_denials": "PASS",
    "observer_filesystem_isolation": "PASS",
    "operator_hold_release_cancel": "PASS",
    "operator_terminal_submission": "PASS",
    "terminated_capture_journal": "PASS"
  },
  "fixture": "demo/expected/v1.brf",
  "full_capture": {
    "backend_received_sha256": "9b13336e1833b9491207f26720eae9a8c9132b75a232acdac1a9f76834baa736",
    "candidate_sha256": "9b13336e1833b9491207f26720eae9a8c9132b75a232acdac1a9f76834baa736",
    "captured_output_sha256": "9b13336e1833b9491207f26720eae9a8c9132b75a232acdac1a9f76834baa736",
    "event_chain_valid": true,
    "manifest_schema_valid": true,
    "pages_completed": 1,
    "pages_total": 1,
    "state": "COMPLETED",
    "terminal_event_sha256": "178498f4a6c45ffce462fa2438cfe2b7b9a50dbfd0a717fe79477892d179fce5"
  },
  "queue": "Braille-Embosser-Sim",
  "recorded_at": "2026-08-29T04:21:57.9232028Z",
  "schema_version": "gate0-local-floor-evidence.v1",
  "simulated_endpoint": true,
  "terminated_capture": {
    "backend_received_sha256": "c4b9c180d768ac362b21acfc10a2d57cf3b1419d08dd48fc0e70bf139bad9e68",
    "candidate_sha256": "c4b9c180d768ac362b21acfc10a2d57cf3b1419d08dd48fc0e70bf139bad9e68",
    "captured_output_sha256": null,
    "event_chain_valid": true,
    "manifest_schema_valid": true,
    "pages_completed": 1,
    "pages_total": 12,
    "state": "TERMINATED",
    "terminal_event_sha256": "5f9bdc9c4776e8fd120cba766fce234e35cf74b20b1cf9fbea7877019b103d46"
  }
}
